Name: A Light in the Attic,  Price: £51.77
 
Name: Tipping the Velvet,  Price: £53.74
 
Name: Soumission,  Price: £50.10
 
Name: Sharp Objects,  Price: £47.82
 
Name: Sapiens: A Brief History of Humankind,  Price: £54.23
 
Name: The Requiem Red,  Price: £22.65
 
Name: The Dirty Little Secrets of Getting Your Dream Job,  Price: £33.34
 
"Name: The Coming Woman: A Novel Based on the Life of the Infamous Feminist, Victoria Woodhull",  Price: £17.93
 
Name: The Boys in the Boat: Nine Americans and Their Epic Quest for Gold at the 1936 Berlin Olympics,  Price: £22.60
 
Name: The Black Maria,  Price: £52.15
 
"Name: Starving Hearts (Triangular Trade Trilogy, #1)",  Price: £13.99
 
Name: Shakespeare's Sonnets,  Price: £20.66
 
Name: Set Me Free,  Price: £17.46
 
Name: Scott Pilgrim's Precious Little Life (Scott Pilgrim #1),  Price: £52.29
 
Name: Rip it Up and Start Again,  Price: £35.02
 
"Name: Our Band Could Be Your Life: Scenes from the American Indie Underground, 1981-1991",  Price: £57.25
 
Name: Olio,  Price: £23.88
 
Name: Mesaerion: The Best Science Fiction Stories 1800-1849,  Price: £37.59
 
Name: Libertarianism for Beginners,  Price: £51.33
 
Name: It's Only the Himalayas,  Price: £45.17
 
Name: In Her Wake,  Price: £12.84
 
Name: How Music Works,  Price: £37.32
 
"Name: Foolproof Preserving: A Guide to Small Batch Jams, Jellies, Pickles, Condiments, and More: A Foolproof Guide to Making Small Batch Jams, Jellies, Pickles, Condiments, and More",  Price: £30.52
 
Name: Chase Me (Paris Nights #2),  Price: £25.27
 
Name: Black Dust,  Price: £34.53
 
Name: Birdsong: A Story in Pictures,  Price: £54.64
 
Name: America's Cradle of Quarterbacks: Western Pennsylvania's Football Factory from Johnny Unitas to Joe Montana,  Price: £22.50
 
Name: Aladdin and His Wonderful Lamp,  Price: £53.13
 
Name: Worlds Elsewhere: Journeys Around Shakespeare’s Globe,  Price: £40.30
 
Name: Wall and Piece,  Price: £44.18
 
Name: The Four Agreements: A Practical Guide to Personal Freedom,  Price: £17.66
 
Name: The Five Love Languages: How to Express Heartfelt Commitment to Your Mate,  Price: £31.05
 
Name: The Elephant Tree,  Price: £23.82
 
Name: The Bear and the Piano,  Price: £36.89
 
Name: Sophie's World,  Price: £15.94
 
Name: Penny Maybe,  Price: £33.29
 
Name: Maude (1883-1993):She Grew Up with the country,  Price: £18.02
 
"Name: In a Dark, Dark Wood",  Price: £19.63
 
Name: Behind Closed Doors,  Price: £52.22
 
Name: You can't bury them all: Poems,  Price: £33.63
 
Name: Slow States of Collapse: Poems,  Price: £57.31
 
Name: Reasons to Stay Alive,  Price: £26.41
 
Name: Private Paris (Private #10),  Price: £47.61
 
Name: #HigherSelfie: Wake Up Your Life. Free Your Soul. Find Your Tribe.,  Price: £23.11
 
Name: Without Borders (Wanderlove #1),  Price: £45.07
 
Name: When We Collided,  Price: £31.77
 
"Name: We Love You, Charlie Freeman",  Price: £50.27
 
Name: Untitled Collection: Sabbath Poems 2014,  Price: £14.27
 
"Name: Unseen City: The Majesty of Pigeons, the Discreet Charm of Snails & Other Wonders of the Urban Wilderness",  Price: £44.18
 
Name: Unicorn Tracks,  Price: £18.78
 
"Name: Unbound: How Eight Technologies Made Us Human, Transformed Society, and Brought Our World to the Brink",  Price: £25.52
 
Name: Tsubasa: WoRLD CHRoNiCLE 2 (Tsubasa WoRLD CHRoNiCLE #2),  Price: £16.28
 
Name: Throwing Rocks at the Google Bus: How Growth Became the Enemy of Prosperity,  Price: £31.12
 
Name: This One Summer,  Price: £19.49
 
Name: Thirst,  Price: £17.27
 
Name: The Torch Is Passed: A Harding Family Story,  Price: £19.09
 
Name: The Secret of Dreadwillow Carse,  Price: £56.13
 
"Name: The Pioneer Woman Cooks: Dinnertime: Comfort Classics, Freezer Food, 16-Minute Meals, and Other Delicious Ways to Solve Supper!",  Price: £56.41
 
Name: The Past Never Ends,  Price: £56.50
 
Name: The Natural History of Us (The Fine Art of Pretending #2),  Price: £45.22
 
Name: The Nameless City (The Nameless City #1),  Price: £38.16
 
Name: The Murder That Never Was (Forensic Instincts #5),  Price: £54.11
 
Name: The Most Perfect Thing: Inside (and Outside) a Bird's Egg,  Price: £42.96
 
"Name: The Mindfulness and Acceptance Workbook for Anxiety: A Guide to Breaking Free from Anxiety, Phobias, and Worry Using Acceptance and Commitment Therapy",  Price: £23.89
 
Name: The Life-Changing Magic of Tidying Up: The Japanese Art of Decluttering and Organizing,  Price: £16.77
 
"Name: The Inefficiency Assassin: Time Management Tactics for Working Smarter, Not Longer",  Price: £20.59
 
Name: The Gutsy Girl: Escapades for Your Life of Epic Adventure,  Price: £37.13
 
Name: The Electric Pencil: Drawings from Inside State Hospital No. 3,  Price: £56.06
 
Name: The Death of Humanity: and the Case for Life,  Price: £58.11
 
"Name: The Bulletproof Diet: Lose up to a Pound a Day, Reclaim Energy and Focus, Upgrade Your Life",  Price: £49.05
 
Name: The Art Forger,  Price: £40.76
 
Name: The Age of Genius: The Seventeenth Century and the Birth of the Modern Mind,  Price: £19.73
 
Name: The Activist's Tao Te Ching: Ancient Advice for a Modern Revolution,  Price: £32.24
 
Name: Spark Joy: An Illustrated Master Class on the Art of Organizing and Tidying Up,  Price: £41.83
 
Name: Soul Reader,  Price: £39.58
 
Name: Security,  Price: £39.25
 
"Name: Saga, Volume 6 (Saga (Collected Editions) #6)",  Price: £25.02
 
"Name: Saga, Volume 5 (Saga (Collected Editions) #5)",  Price: £51.04
 
Name: Reskilling America: Learning to Labor in the Twenty-First Century,  Price: £19.83
 
"Name: Rat Queens, Vol. 3: Demons (Rat Queens (Collected Editions) #11-15)",  Price: £50.40
 
"Name: Princess Jellyfish 2-in-1 Omnibus, Vol. 01 (Princess Jellyfish 2-in-1 Omnibus #1)",  Price: £13.61
 
Name: Princess Between Worlds (Wide-Awake Princess #5),  Price: £13.34
 
"Name: Pop Gun War, Volume 1: Gift",  Price: £18.97
 
"Name: Political Suicide: Missteps, Peccadilloes, Bad Calls, Backroom Hijinx, Sordid Pasts, Rotten Breaks, and Just Plain Dumb Mistakes in the Annals of American Politics",  Price: £36.28
 
Name: Patience,  Price: £10.16
 
"Name: Outcast, Vol. 1: A Darkness Surrounds Him (Outcast #1)",  Price: £15.44
 
Name: orange: The Complete Collection 1 (orange: The Complete Collection #1),  Price: £48.41
 
Name: Online Marketing for Busy Authors: A Step-By-Step Guide,  Price: £46.35
 
Name: On a Midnight Clear,  Price: £14.07
 
Name: Obsidian (Lux #1),  Price: £14.86
 
Name: My Paris Kitchen: Recipes and Stories,  Price: £33.37
 
Name: Masks and Shadows,  Price: £56.40
 
"Name: Mama Tried: Traditional Italian Cooking for the Screwed, Crude, Vegan, and Tattooed",  Price: £14.02
 
"Name: Lumberjanes, Vol. 2: Friendship to the Max (Lumberjanes #5-8)",  Price: £46.91
 
"Name: Lumberjanes, Vol. 1: Beware the Kitten Holy (Lumberjanes #1-4)",  Price: £45.61
 
Name: Lumberjanes Vol. 3: A Terrible Plan (Lumberjanes #9-12),  Price: £19.92
 
"Name: Layered: Baking, Building, and Styling Spectacular Cakes",  Price: £40.11
 
Name: Judo: Seven Steps to Black Belt (an Introductory Guide for Beginners),  Price: £53.90
 
Name: Join,  Price: £35.67
 
Name: In the Country We Love: My Family Divided,  Price: £22.00